{
  "schema_version": "1.1",
  "generator": {
    "track": "python",
    "version": "1.1.0"
  },
  "dataset": {
    "export": "2026-07",
    "period_end": "2026-07-31",
    "contract_version": "1.1.0"
  },
  "data_quality": {
    "raw_rows": {
      "customers": 6377,
      "invoices": 34570,
      "usage": 32826,
      "tickets": 7628
    },
    "clean_rows": {
      "customers": 6294,
      "invoices": 34368,
      "usage": 32539,
      "tickets": 7612
    },
    "issues": {
      "customers_invalid_signup_date": 4,
      "customers_exact_duplicates": 79,
      "customers_channel_missing": 508,
      "customers_age_band_missing": 207,
      "invoices_exact_duplicates": 173,
      "invoices_orphans": 29,
      "usage_exact_duplicates": 171,
      "usage_negative_counts": 62,
      "usage_orphans": 54,
      "tickets_invalid_created_at": 0,
      "tickets_resolved_before_created": 35,
      "tickets_orphans": 16
    },
    "checks": [
      {
        "id": "customers.customer_id.unique",
        "severity": "error",
        "status": "pass",
        "failing_rows": 0,
        "observed": 0.0
      },
      {
        "id": "customers.signup_date.not_null",
        "severity": "error",
        "status": "pass",
        "failing_rows": 0,
        "observed": 0.0
      },
      {
        "id": "customers.city.accepted",
        "severity": "error",
        "status": "pass",
        "failing_rows": 0,
        "observed": 0.0
      },
      {
        "id": "customers.channel.accepted",
        "severity": "error",
        "status": "pass",
        "failing_rows": 0,
        "observed": 0.0
      },
      {
        "id": "customers.age_band.accepted",
        "severity": "error",
        "status": "pass",
        "failing_rows": 0,
        "observed": 0.0
      },
      {
        "id": "customers.channel.missing_share",
        "severity": "warn",
        "status": "pass",
        "failing_rows": 508,
        "observed": 0.08071178900540198
      },
      {
        "id": "invoices.invoice_id.unique",
        "severity": "error",
        "status": "pass",
        "failing_rows": 0,
        "observed": 0.0
      },
      {
        "id": "invoices.kind.accepted",
        "severity": "error",
        "status": "pass",
        "failing_rows": 0,
        "observed": 0.0
      },
      {
        "id": "invoices.status.accepted",
        "severity": "error",
        "status": "pass",
        "failing_rows": 0,
        "observed": 0.0
      },
      {
        "id": "invoices.plan.accepted",
        "severity": "error",
        "status": "pass",
        "failing_rows": 0,
        "observed": 0.0
      },
      {
        "id": "invoices.list_price.range",
        "severity": "error",
        "status": "pass",
        "failing_rows": 0,
        "observed": 0.0
      },
      {
        "id": "invoices.customer.exists",
        "severity": "error",
        "status": "pass",
        "failing_rows": 0,
        "observed": 0.0
      },
      {
        "id": "usage.key.unique",
        "severity": "error",
        "status": "pass",
        "failing_rows": 0,
        "observed": 0.0
      },
      {
        "id": "usage.meals_ordered.range",
        "severity": "error",
        "status": "pass",
        "failing_rows": 0,
        "observed": 0.0
      },
      {
        "id": "usage.customer.exists",
        "severity": "error",
        "status": "pass",
        "failing_rows": 0,
        "observed": 0.0
      },
      {
        "id": "tickets.ticket_id.unique",
        "severity": "error",
        "status": "pass",
        "failing_rows": 0,
        "observed": 0.0
      },
      {
        "id": "tickets.category.accepted",
        "severity": "error",
        "status": "pass",
        "failing_rows": 0,
        "observed": 0.0
      },
      {
        "id": "tickets.customer.exists",
        "severity": "error",
        "status": "pass",
        "failing_rows": 0,
        "observed": 0.0
      },
      {
        "id": "raw.usage.negative_counts",
        "severity": "warn",
        "status": "pass",
        "failing_rows": 62,
        "observed": 0.0018887467251568878
      },
      {
        "id": "snapshots.rows.min",
        "severity": "error",
        "status": "pass",
        "failing_rows": 0,
        "observed": 0.0
      },
      {
        "id": "snapshots.churn_rate.range",
        "severity": "error",
        "status": "pass",
        "failing_rows": 0,
        "observed": 0.0
      }
    ]
  },
  "snapshots": [
    {
      "snapshot": "2025-09",
      "split": "train",
      "rows": 1608,
      "churned": 159,
      "churn_rate": 0.09888059701492537
    },
    {
      "snapshot": "2025-10",
      "split": "train",
      "rows": 1769,
      "churned": 189,
      "churn_rate": 0.10684002261164499
    },
    {
      "snapshot": "2025-11",
      "split": "train",
      "rows": 1909,
      "churned": 199,
      "churn_rate": 0.10424305919329492
    },
    {
      "snapshot": "2025-12",
      "split": "train",
      "rows": 2046,
      "churned": 197,
      "churn_rate": 0.09628543499511241
    },
    {
      "snapshot": "2026-01",
      "split": "train",
      "rows": 2194,
      "churned": 211,
      "churn_rate": 0.09617137648131267
    },
    {
      "snapshot": "2026-02",
      "split": "train",
      "rows": 2336,
      "churned": 198,
      "churn_rate": 0.08476027397260275
    },
    {
      "snapshot": "2026-03",
      "split": "test",
      "rows": 2496,
      "churned": 214,
      "churn_rate": 0.08573717948717949
    },
    {
      "snapshot": "2026-04",
      "split": "test",
      "rows": 2652,
      "churned": 239,
      "churn_rate": 0.09012066365007541
    },
    {
      "snapshot": "2026-05",
      "split": "recent",
      "rows": 2791,
      "churned": 391,
      "churn_rate": 0.14009315657470442
    },
    {
      "snapshot": "2026-06",
      "split": "holdout",
      "rows": 2873,
      "churned": 479,
      "churn_rate": 0.16672467803689522
    },
    {
      "snapshot": "2026-07",
      "split": "score",
      "rows": 2873,
      "churned": null,
      "churn_rate": null
    }
  ],
  "split": {
    "train_snapshots": [
      "2025-09",
      "2025-10",
      "2025-11",
      "2025-12",
      "2026-01",
      "2026-02"
    ],
    "test_snapshots": [
      "2026-03",
      "2026-04"
    ],
    "train_rows": 11862,
    "test_rows": 5148,
    "train_churn_rate": 0.09720114651829372,
    "test_churn_rate": 0.087995337995338,
    "folds": [
      {
        "fold": 0,
        "rows": 2273,
        "customers": 649,
        "churners": 252
      },
      {
        "fold": 1,
        "rows": 2553,
        "customers": 681,
        "churners": 216
      },
      {
        "fold": 2,
        "rows": 2290,
        "customers": 652,
        "churners": 240
      },
      {
        "fold": 3,
        "rows": 2428,
        "customers": 665,
        "churners": 233
      },
      {
        "fold": 4,
        "rows": 2318,
        "customers": 644,
        "churners": 212
      }
    ],
    "customers_in_two_folds": 0
  },
  "leakage": {
    "feature_auc": {
      "tenure_months": 0.640808037139895,
      "is_new": 0.6209957710388933,
      "plan_standard": 0.5103142933572583,
      "plan_premium": 0.5013817397675655,
      "discount_share": 0.5895915821507504,
      "price_change_pct": 0.509408116330162,
      "meals_last_month": 0.6602341514788811,
      "skip_rate_last_month": 0.7033188642505671,
      "meals_trend": 0.5164116928502884,
      "late_rate_3m": 0.510647762291843,
      "avg_rating_3m": 0.6574294489473437,
      "rating_missing": 0.5110982591828274,
      "tickets_90d": 0.5356839295995449,
      "open_tickets": 0.502753801444619,
      "failed_payments_3m": 0.5095861284050175
    },
    "max_feature": "skip_rate_last_month",
    "max_feature_auc": 0.7033188642505671,
    "limit": 0.9,
    "probe": "customers.cancellation_reason is filled",
    "probe_auc": 0.8061443645531796,
    "passed": true
  },
  "experiments": [
    {
      "id": "B0",
      "name": "prior: everyone gets the training churn rate",
      "kind": "prior",
      "features": [],
      "cv": {
        "auc_mean": 0.5,
        "auc_sd": 0.0,
        "brier_mean": 0.08807536954185863,
        "log_loss_mean": 0.31992639452235316,
        "folds": [
          {
            "fold": 0,
            "rows": 2273,
            "auc": 0.5,
            "brier": 0.09886104616689438,
            "log_loss": 0.3499191514957917
          },
          {
            "fold": 1,
            "rows": 2553,
            "auc": 0.5,
            "brier": 0.07770568007523902,
            "log_loss": 0.2913737881117955
          },
          {
            "fold": 2,
            "rows": 2290,
            "auc": 0.5,
            "brier": 0.0939084788674005,
            "log_loss": 0.3360108200715894
          },
          {
            "fold": 3,
            "rows": 2428,
            "auc": 0.5,
            "brier": 0.08675713435901973,
            "log_loss": 0.31613664529317187
          },
          {
            "fold": 4,
            "rows": 2318,
            "auc": 0.5,
            "brier": 0.08314450824073948,
            "log_loss": 0.3061915676394174
          }
        ]
      },
      "test": {
        "auc": 0.5,
        "average_precision": 0.087995337995338,
        "brier": 0.08033690539698553,
        "log_loss": 0.29837223330310225,
        "ece": 0.009205808522955702,
        "contacted": 516,
        "churners_reached": 25,
        "precision_at_top": 0.04844961240310078,
        "recall_at_top": 0.05518763796909492,
        "lift_at_top": 0.5505929462498075,
        "net_value_inr_per_month": -22771.875
      }
    },
    {
      "id": "B1",
      "name": "rule of thumb: the retention team's risk flags",
      "kind": "rule",
      "features": [],
      "cv": {
        "auc_mean": 0.6665918079752469,
        "auc_sd": 0.009766295309196303,
        "brier_mean": 0.08428518338340973,
        "log_loss_mean": 0.3007988410669336,
        "folds": [